id,title,seller_id,price,description,category,length,width,height,image,remaining,created_at,updated_at
139,Mrs. Lee's Simple Imagination Variance 367,55,239536,Mrs. Lee's Simple Imagination Variance 367 is a luxury tv that cannot be found in your local stores! Specific carry consider single power. Kind eight such enter use population forward. Drug fact cell heavy ability.,TV,3.27,0.64,2.41,care.tiff,62,1980-11-27 00:49:03.000000,1999-05-22 08:20:09.000000
140,Born in Christmas Island: Spare Competition Version 320,74,92523,Born in Christmas Island: Spare Competition Version 320 is a luxury male accessories that cannot be found in your local stores! Feeling mean focus keep under. Value now task stage one price term race. Hair drop force single. Reveal ago pressure eye police.,Male Accessories,4.63,0.99,1.9,room.gif,74,1996-07-17 22:49:32.000000,2002-11-30 01:47:35.000000
141,Ind. Lopez's Angry Cookie No. 103,64,952422,Ind. Lopez's Angry Cookie No. 103 is a luxury floor decoration that cannot be found in your local stores! Bag college who decade. Attorney catch pattern research then you.,Floor Decoration,4.88,0.96,2.85,real.jpeg,89,1989-08-17 07:51:19.000000,2006-09-06 20:12:58.000000
142,Born in Netherlands Antilles: Valuable Policy MK 36,60,653313,Born in Netherlands Antilles: Valuable Policy MK 36 is a luxury tv that cannot be found in your local stores! About decide expert class various back design. Store realize staff moment one effect current. Office floor some manager opportunity image certain.,TV,2.28,2.21,4.14,different.gif,58,1992-11-27 12:27:28.000000,2021-08-11 23:39:51.000000
143,Mx. Carter's Human Button MK 588,73,205677,Mx. Carter's Human Button MK 588 is a luxury girl clothing and accessories that cannot be found in your local stores! East ahead continue simply. Trial particular stay fine. Culture key worry.,Girl Clothing and Accessories,1.36,2.69,3.85,though.png,12,1981-05-21 22:18:07.000000,2014-11-20 13:27:42.000000
144,Cordova Ltd's Exact Interaction No. 478,23,400528,Cordova Ltd's Exact Interaction No. 478 is a luxury male accessories that cannot be found in your local stores! Early positive really lot pass I. I PM through yet candidate. Address film approach care animal moment actually. Could establish so behind.,Male Accessories,2.24,0.29,1.31,collection.bmp,101,1989-04-26 11:00:18.000000,2020-01-19 10:08:15.000000
145,Freeman Group's Strong Holiday Version 301,33,545989,Freeman Group's Strong Holiday Version 301 is a luxury female accessories that cannot be found in your local stores! Performance thousand former beautiful. Article imagine church reason.,Female Accessories,2.13,2.63,4.16,a.tiff,2,1973-07-26 12:09:12.000000,1979-08-04 11:34:22.000000
146,Azure Perfect Shopping MK 765,52,693234,Azure Perfect Shopping MK 765 is a luxury computer that cannot be found in your local stores! Response exist building magazine pull. Baby gun can cold modern common box. Understand total people difference investment change.,Computer,4.28,4.64,0.63,the.jpg,62,1988-01-17 12:14:47.000000,2006-04-12 05:05:33.000000
147,Young-Guzman's Unique Character Gen. 595,33,898335,Young-Guzman's Unique Character Gen. 595 is a luxury phone accessories that cannot be found in your local stores! West news there myself assume that. Know teacher run across course.,Phone Accessories,4.06,3.41,0.88,many.png,26,1996-03-07 17:02:09.000000,2022-02-05 17:04:10.000000
148,Porter LLC's Psychological Mail Version 327,66,767131,Porter LLC's Psychological Mail Version 327 is a luxury chairs and sofas that cannot be found in your local stores! Father every word traditional artist hair rule or. Strategy easy audience scientist building. Pretty writer scientist civil have item beyond.,Chairs and Sofas,4.64,1.91,0.31,middle.bmp,19,1976-04-27 07:49:05.000000,1978-02-07 00:54:50.000000
149,Turquoise Inner Extent Variance 679,74,774366,Turquoise Inner Extent Variance 679 is a luxury computer that cannot be found in your local stores! City enough product Democrat east. Good half fly buy house daughter. Will forward majority last.,Computer,3.79,3.2,0.84,he.jpg,130,1989-05-18 11:01:31.000000,2018-11-24 20:37:09.000000
150,PaleTurquoise Several Safety Gen. 472,38,619013,PaleTurquoise Several Safety Gen. 472 is a luxury floor decoration that cannot be found in your local stores! Pressure raise arrive also. To eat new these friend serious none. Spring will happen certain all be day.,Floor Decoration,0.67,3.59,3.76,already.jpg,140,1984-08-18 08:35:26.000000,1993-08-22 22:38:45.000000
151,Born in Christmas Island: Creative Priority Gen. 964,34,146426,Born in Christmas Island: Creative Priority Gen. 964 is a luxury tv that cannot be found in your local stores! Hope base if nice deep. Industry Mrs discuss. Race deep model new land ten. Level trial parent head big edge however.,TV,3.04,4.01,0.73,whom.gif,26,1987-05-12 05:49:28.000000,1996-12-07 16:02:52.000000
152,Made in Micronesia: Anxious Opinion Edition 593,62,447182,Made in Micronesia: Anxious Opinion Edition 593 is a luxury phone accessories that cannot be found in your local stores! Store environment heart. Least lose item almost. Nearly message attention.,Phone Accessories,2.72,2.95,2.63,paper.png,97,1997-01-09 00:04:27.000000,2023-06-07 03:51:40.000000
153,Mrs. Lozano's Young Fault No. 17,15,313602,Mrs. Lozano's Young Fault No. 17 is a luxury male accessories that cannot be found in your local stores! Throughout away together stuff. Five brother toward. Difficult question trial top skill style hour. Concern many out knowledge give place.,Male Accessories,1.12,4.01,2.77,first.bmp,142,2007-07-19 19:57:11.000000,2022-06-12 08:38:10.000000
154,Made in Chile: Healthy Smoke Variance 706,15,566573,Made in Chile: Healthy Smoke Variance 706 is a luxury male accessories that cannot be found in your local stores! Energy about structure past ask throw clearly. Street officer central window then front.,Male Accessories,0.25,0.74,0.78,impact.tiff,125,1992-12-06 10:36:07.000000,1996-05-26 07:20:01.000000
155,Made in Monaco: Drunk Knee Gen. 39,60,652208,Made in Monaco: Drunk Knee Gen. 39 is a luxury phone accessories that cannot be found in your local stores! Arm place begin. Have forget film top clearly. Effect mention natural actually gas husband. Carry improve term race toward.,Phone Accessories,2.64,2.47,4.09,husband.gif,32,1987-11-06 23:41:38.000000,2001-07-17 18:59:30.000000
156,IndianRed Automatic Investment No. 936,41,570901,IndianRed Automatic Investment No. 936 is a luxury computer accessories that cannot be found in your local stores! Quite get total year. Kind pick both oil event. Sit investment strong west. Study doctor see government. Human look range leader.,Computer Accessories,4.02,0.27,1.69,number.jpeg,85,1991-01-05 04:05:25.000000,2009-01-26 17:37:17.000000
157,MediumSpringGreen Junior Church Version 578,35,58298,MediumSpringGreen Junior Church Version 578 is an affordably priced phone that cannot be found in your local stores! Scientist star idea. Company could none left ask simply. Include want heavy popular.,Phone,1.92,2.3,2.73,part.bmp,67,1985-11-14 21:55:32.000000,2018-08-04 02:44:02.000000
158,"Walker, Howard and Curtis's Extra Point No. 563",16,43962,"Walker, Howard and Curtis's Extra Point No. 563 is an affordably priced floor decoration that cannot be found in your local stores! According manager ask modern five determine. Late soldier wear although operation. Image artist consumer leave difficult.",Floor Decoration,4.72,3.4,4.39,cover.jpg,90,2011-10-24 00:25:36.000000,2018-10-07 06:00:53.000000
159,Born in United States Minor Outlying Islands: Helpful Sale Gen. 275,62,515814,Born in United States Minor Outlying Islands: Helpful Sale Gen. 275 is a luxury chairs and sofas that cannot be found in your local stores! Capital old sort. Congress agreement guess front many rest blood.,Chairs and Sofas,1.65,3.34,4.37,million.jpg,45,1991-10-31 08:23:28.000000,2005-09-16 03:45:32.000000
160,Mrs. Lynn's Professional Feeling Gen. 371,95,314075,Mrs. Lynn's Professional Feeling Gen. 371 is a luxury male accessories that cannot be found in your local stores! Old environmental hotel see among own top. Staff appear stuff street for food rock. True moment choice serve. Window people you speech buy.,Male Accessories,2.51,1.14,2.12,year.png,121,1992-12-05 03:09:23.000000,2022-11-26 06:54:34.000000
161,LightGoldenRodYellow Informal Boot MK 607,38,803826,LightGoldenRodYellow Informal Boot MK 607 is a luxury male accessories that cannot be found in your local stores! Item inside I decide easy. Successful water agent involve significant color. Movement win check laugh.,Male Accessories,4.61,3.77,1.17,within.jpeg,5,1977-05-31 11:55:08.000000,1998-05-19 16:25:19.000000
162,Born in Ecuador: Dependent Death Edition 813,28,866063,Born in Ecuador: Dependent Death Edition 813 is a luxury tv that cannot be found in your local stores! Case argue choose plant which structure color. Beyond agent early agent citizen scientist painting. Data public message condition human tell.,TV,0.83,2.76,4.89,strong.tiff,118,2011-03-30 09:10:55.000000,2021-12-08 17:48:20.000000
163,Born in Lebanon: Working Computer Prototype #369,26,811081,Born in Lebanon: Working Computer Prototype #369 is a luxury phone that cannot be found in your local stores! Wait clear safe. Section serve fear single. Air few team can public really note.,Phone,0.76,0.7,1.48,sea.jpg,111,1990-04-21 14:44:51.000000,2003-12-27 12:12:35.000000
164,Born in Malta: Weird Space Prototype #16,52,391346,Born in Malta: Weird Space Prototype #16 is a luxury boy clothing and accessories that cannot be found in your local stores! Three everybody beautiful address money experience. Former film share key field challenge. Less grow buy quickly better. Even blue realize movie.,Boy Clothing and Accessories,0.61,1.38,1.04,road.bmp,56,2011-03-10 11:59:58.000000,2019-11-14 05:29:57.000000
165,Dr. Jenkins's Certain Virus MK 769,34,952562,Dr. Jenkins's Certain Virus MK 769 is a luxury refridgerator that cannot be found in your local stores! In now oil indicate we commercial image. Oil view smile example their business yes.,Refridgerator,1.37,1.38,1.27,second.jpeg,40,1988-04-05 14:43:05.000000,1998-11-13 18:11:05.000000
166,Made in Estonia: Natural Population Version 287,52,751543,Made in Estonia: Natural Population Version 287 is a luxury wall decoration that cannot be found in your local stores! Reason crime blood participant tonight. Wear they discussion Republican camera start exactly. Including doctor itself me mother economic seat.,Wall Decoration,4.02,2.05,2.55,suddenly.gif,62,1976-09-02 20:49:16.000000,1980-05-17 13:57:00.000000
167,Mrs. Gonzalez's Scared Wine Edition 973,51,14411,Mrs. Gonzalez's Scared Wine Edition 973 is a cheap female accessories that cannot be found in your local stores! Crime career explain cost movement field. Paper process buy theory rest discover.,Female Accessories,2.53,0.32,1.38,seven.png,35,2000-08-24 22:59:00.000000,2020-09-10 06:40:11.000000
168,Born in Guinea-Bissau: Most Security Variance 937,99,127709,Born in Guinea-Bissau: Most Security Variance 937 is a luxury computer that cannot be found in your local stores! Worker recently too weight simply. Sometimes young set again.,Computer,4.68,4.01,2.33,indeed.jpg,109,1971-01-04 15:01:51.000000,1992-05-13 19:20:19.000000
169,Ind. Villarreal's Sudden Weekend Version 940,94,986605,Ind. Villarreal's Sudden Weekend Version 940 is a luxury phone accessories that cannot be found in your local stores! Beat tough land avoid notice. Far husband enough community result pay later. Face well maintain.,Phone Accessories,1.54,1.59,1.05,entire.jpg,117,2003-05-02 12:51:16.000000,2007-04-25 05:51:55.000000
170,DarkOliveGreen Strong Sector Edition 901,16,330161,DarkOliveGreen Strong Sector Edition 901 is a luxury cooker and oven that cannot be found in your local stores! Sense surface air. Various side radio home well chance.,Cooker and Oven,4.28,4.97,4.58,practice.gif,71,1987-07-22 08:03:31.000000,2000-10-11 06:33:17.000000
171,Mr. Garcia's National Speed Gen. 924,67,740663,Mr. Garcia's National Speed Gen. 924 is a luxury male sportswear that cannot be found in your local stores! Ten summer environment. Say give message. College power door available answer mention practice. Might today expert military.,Male Sportswear,4.3,1.67,2.06,develop.jpeg,31,1976-11-23 19:22:36.000000,2011-08-27 19:00:19.000000
172,Made in Congo: Used Teaching Edition 708,34,358367,Made in Congo: Used Teaching Edition 708 is a luxury girl clothing and accessories that cannot be found in your local stores! Doctor establish discuss agent understand night race. Popular gun either institution after. Them garden stuff send over.,Girl Clothing and Accessories,2.44,1.88,3.55,size.bmp,118,1999-02-21 22:43:20.000000,2017-01-03 01:57:19.000000
173,Mx. Baker's Valuable Market Gen. 95,94,457864,Mx. Baker's Valuable Market Gen. 95 is a luxury girl clothing and accessories that cannot be found in your local stores! President air shoulder authority fill. Other such much stand international away.,Girl Clothing and Accessories,4.14,1.22,4.13,recognize.gif,124,1978-03-02 18:56:14.000000,2014-11-13 02:57:39.000000
174,Made in Afghanistan: Interesting Shame Edition 672,28,877144,Made in Afghanistan: Interesting Shame Edition 672 is a luxury tv that cannot be found in your local stores! Smile growth get list page able agreement. Past and short recent act. Language light improve many.,TV,3.45,2.66,4.99,last.gif,73,1994-03-31 18:11:55.000000,2004-02-05 05:58:50.000000
175,Blue Neat Evidence Variance 314,84,51638,Blue Neat Evidence Variance 314 is an affordably priced wall decoration that cannot be found in your local stores! Yet fact ball. Husband entire guess without. Grow other term responsibility will more. Alone space high lose voice strong trouble want.,Wall Decoration,1.51,1.88,4.51,through.tiff,9,1979-11-30 16:24:05.000000,1995-12-26 15:08:21.000000
176,Moody-Brown's Unusual Share Edition 453,8,605933,Moody-Brown's Unusual Share Edition 453 is a luxury computer accessories that cannot be found in your local stores! Resource computer place look dream hand TV. Interesting lose institution lead still. Former bit phone guy simple.,Computer Accessories,0.85,4.03,3.49,certainly.jpeg,135,2003-12-22 23:18:06.000000,2007-11-05 05:28:21.000000
177,Tomato Legal Answer Edition 64,38,500052,Tomato Legal Answer Edition 64 is a luxury lamps that cannot be found in your local stores! Her garden institution industry. Tend require budget young your serious. Yes short see place least.,Lamps,3.72,2.36,3.83,win.gif,45,2009-10-02 00:40:14.000000,2011-01-05 04:17:20.000000
178,"Smith, Saunders and Strong's Normal Beach Prototype #811",33,960366,"Smith, Saunders and Strong's Normal Beach Prototype #811 is a luxury female accessories that cannot be found in your local stores! Town allow throw evening nation others. Performance thus cold culture international. Final voice two beautiful well.",Female Accessories,0.5,4.69,2.91,color.tiff,21,1979-05-12 23:40:48.000000,1998-08-03 16:36:44.000000
179,Born in Albania: Smooth Role No. 759,100,315304,Born in Albania: Smooth Role No. 759 is a luxury female sportswear that cannot be found in your local stores! Glass scene already south language start prove meet. Great kid dark rest use piece. Industry catch simple current black our.,Female Sportswear,1.46,3.63,2.81,her.png,97,1978-02-07 21:28:00.000000,1997-03-29 23:31:21.000000
180,SkyBlue Solid Iron No. 737,34,917522,SkyBlue Solid Iron No. 737 is a luxury chairs and sofas that cannot be found in your local stores! Senior produce must ever yet. Lead subject doctor learn car own.,Chairs and Sofas,4.81,0.3,2.11,baby.gif,15,2013-06-24 05:25:37.000000,2021-12-19 15:46:30.000000
181,Made in Papua New Guinea: Clear Income Version 217,11,116964,Made in Papua New Guinea: Clear Income Version 217 is a luxury phone accessories that cannot be found in your local stores! Turn these cultural health next. Various arrive pattern. Out provide mouth nearly government. Most charge image. Try ten whole turn.,Phone Accessories,1.89,3.15,1.71,us.bmp,59,1985-07-05 22:38:15.000000,1990-04-29 23:58:15.000000
182,Mr. Alvarez's Angry Part Prototype #225,15,2785,Mr. Alvarez's Angry Part Prototype #225 is a cheap boy clothing and accessories that cannot be found in your local stores! Little environment side audience since. Plant federal almost month.,Boy Clothing and Accessories,2.21,0.84,1.49,detail.png,118,1977-03-13 21:53:19.000000,2000-07-04 01:04:50.000000
183,"Pitts, Nelson and Miller's Rare Health Edition 837",34,675459,"Pitts, Nelson and Miller's Rare Health Edition 837 is a luxury floor decoration that cannot be found in your local stores! Herself must property agree man. Ago them give.",Floor Decoration,4.08,3.96,3.27,entire.png,72,1980-08-06 18:31:40.000000,2005-03-24 13:00:51.000000
184,Hernandez-Mcdowell's Few Atmosphere No. 654,5,446587,Hernandez-Mcdowell's Few Atmosphere No. 654 is a luxury phone accessories that cannot be found in your local stores! Term standard seem sea commercial. Put view Congress.,Phone Accessories,0.66,2.66,0.71,rock.tiff,64,2014-07-16 18:28:14.000000,2019-03-12 04:06:08.000000
185,Moore-Morris's Pure Life Edition 572,33,202150,Moore-Morris's Pure Life Edition 572 is a luxury computer that cannot be found in your local stores! Those everything ready pressure name hotel. Alone year where PM traditional enough quite.,Computer,4.93,1.11,3.83,watch.jpg,143,1998-10-02 04:59:45.000000,2006-01-31 04:23:39.000000
186,Made in Serbia: Close Farm Edition 722,41,427560,Made in Serbia: Close Farm Edition 722 is a luxury ball sports that cannot be found in your local stores! Black station sea change. Election just perhaps consumer strong. Evening general some bad marriage mind both.,Ball Sports,1.61,2.38,4.22,rule.tiff,139,1977-06-02 09:35:52.000000,2000-04-01 21:14:29.000000
187,"Moore, Graham and Hawkins's Unlikely Head Edition 103",100,511979,"Moore, Graham and Hawkins's Unlikely Head Edition 103 is a luxury female clothing that cannot be found in your local stores! Food generation even brother have produce thing. Art go story according behavior need other. Television office level seven.",Female Clothing,3.21,2.46,0.4,test.gif,98,2018-07-12 06:06:07.000000,2018-08-30 03:59:07.000000
188,LemonChiffon Chemical Nothing Variance 382,16,807700,LemonChiffon Chemical Nothing Variance 382 is a luxury phone that cannot be found in your local stores! Thus certainly sort generation once culture sing boy. Phone audience shake claim section chair could. They sing green recently collection.,Phone,3.4,2.08,3.48,reveal.tiff,124,1984-02-05 14:15:27.000000,2009-11-26 22:08:00.000000
189,Made in Guadeloupe: Active Edge MK 216,28,979101,Made in Guadeloupe: Active Edge MK 216 is a luxury phone accessories that cannot be found in your local stores! Only movie music should. Certainly fight though. Account degree step simply common really compare. Strategy not visit result tax dinner television.,Phone Accessories,4.0,4.42,3.04,activity.jpeg,75,2013-04-09 23:52:53.000000,2016-08-25 01:49:19.000000
190,Edwards-Garcia's Small Marriage Edition 769,35,213262,Edwards-Garcia's Small Marriage Edition 769 is a luxury male accessories that cannot be found in your local stores! Teacher follow wide place. Tree they reduce something personal. Hot director prove theory available surface. Hit generation process training anyone.,Male Accessories,0.65,2.46,4.76,plan.jpg,97,2013-06-12 15:53:19.000000,2018-03-05 23:18:49.000000
191,Made in Taiwan: Huge Surgery Gen. 566,75,41677,Made in Taiwan: Huge Surgery Gen. 566 is an affordably priced boy clothing and accessories that cannot be found in your local stores! Tonight born personal. I foot ready arm. At others leg doctor grow state represent his. Fish like control business.,Boy Clothing and Accessories,2.89,0.6,4.99,within.gif,114,1976-07-20 06:12:19.000000,2016-07-18 11:04:33.000000
192,Made in Germany: Any Culture No. 303,15,225548,Made in Germany: Any Culture No. 303 is a luxury phone that cannot be found in your local stores! Focus score produce audience top move win. Perhaps answer nation people begin individual.,Phone,4.69,3.98,1.37,concern.bmp,115,1995-05-18 20:38:47.000000,2000-09-03 07:14:16.000000
193,Dr. Lee's Exact Resolution Gen. 263,15,726630,Dr. Lee's Exact Resolution Gen. 263 is a luxury computer accessories that cannot be found in your local stores! Station interest deep future PM worker. Media law begin act it. Experience remember exist letter step. Modern ago all budget edge popular minute.,Computer Accessories,3.02,0.98,2.48,beautiful.png,147,1975-07-13 00:35:58.000000,2003-07-19 14:37:17.000000
194,Made in Thailand: Simple Bedroom MK 320,8,491012,Made in Thailand: Simple Bedroom MK 320 is a luxury female clothing that cannot be found in your local stores! Down consumer black smile. Such nice general leave owner. Agent find herself wife worker. Series view fill family take matter central.,Female Clothing,1.49,0.77,1.42,almost.jpeg,48,1979-08-20 13:35:47.000000,1995-12-08 00:13:21.000000
195,Born in Nauru: Similar Grade Prototype #262,100,73655,Born in Nauru: Similar Grade Prototype #262 is a luxury female clothing that cannot be found in your local stores! Woman fall as seven stand run time. Our find argue military. Hospital nearly probably vote success pretty.,Female Clothing,2.23,1.71,3.11,eat.jpg,67,1982-09-09 13:29:16.000000,2001-07-02 07:48:39.000000
196,FireBrick Used Loss Edition 734,16,382918,FireBrick Used Loss Edition 734 is a luxury male sportswear that cannot be found in your local stores! Performance letter want even stay health step. Clear exactly question environmental large myself. Production we management moment all actually dog.,Male Sportswear,3.07,2.32,1.43,spring.bmp,46,1972-05-23 08:19:03.000000,1988-09-13 15:38:18.000000
197,"Baker, Walker and West's Wild Awareness Variance 469",89,734933,"Baker, Walker and West's Wild Awareness Variance 469 is a luxury racket sports that cannot be found in your local stores! Air camera research. Step cause contain growth. This several probably play.",Racket Sports,2.01,3.01,4.33,analysis.bmp,123,1983-03-26 22:50:17.000000,1992-05-10 07:53:28.000000
198,MistyRose Complex Math Edition 489,11,430197,MistyRose Complex Math Edition 489 is a luxury refridgerator that cannot be found in your local stores! Heart business once local. State arm they possible. Current from from including one guess group. Read if despite speech.,Refridgerator,4.68,0.75,0.81,policy.jpg,41,1984-10-15 23:51:04.000000,2011-03-02 12:56:54.000000
199,Cantrell Inc's Mobile Bench Prototype #81,33,263409,Cantrell Inc's Mobile Bench Prototype #81 is a luxury girl clothing and accessories that cannot be found in your local stores! Mean per certain accept. Identify write city. Foot media rate gas. Adult five country sell thousand statement. Hard voice take carry onto they no.,Girl Clothing and Accessories,2.02,1.32,0.63,offer.tiff,131,1974-04-04 00:07:42.000000,1991-07-15 02:10:25.000000
200,LemonChiffon Present Appointment Variance 354,33,312754,LemonChiffon Present Appointment Variance 354 is a luxury female clothing that cannot be found in your local stores! Hope field lawyer good during wait. Network force build because development necessary. Responsibility political however work stop attention.,Female Clothing,2.37,0.69,0.84,know.gif,88,2001-05-01 16:17:31.000000,2008-03-25 22:59:26.000000
