id,title,seller_id,price,description,category,length,width,height,image,remaining,created_at,updated_at
1,Made in Korea: Main Category Variance 541,89,876789,Made in Korea: Main Category Variance 541 is a luxury girl clothing and accessories that cannot be found in your local stores! Two place rule leave begin. Great build set example choose keep pass. Special safe a food. Protect heart travel morning soldier.,Girl Clothing and Accessories,3.51,1.78,4.1,forget.gif,147,2003-11-01 01:24:32.000000,2009-02-27 02:57:03.000000
2,"Watson, Glover and Madden's Overall City Gen. 467",34,535741,"Watson, Glover and Madden's Overall City Gen. 467 is a luxury male accessories that cannot be found in your local stores! Security deal friend seek deep better already. Interview station section thing.",Male Accessories,2.21,4.98,3.93,discuss.bmp,21,1974-06-08 01:29:42.000000,2015-01-12 14:36:25.000000
3,Mrs. Conner's Available Bridge Edition 839,89,10436,Mrs. Conner's Available Bridge Edition 839 is a cheap racket sports that cannot be found in your local stores! North name newspaper. Investment activity gas. Call his school investment way have pay.,Racket Sports,1.26,3.98,4.93,information.png,52,2009-05-09 14:51:08.000000,2009-10-22 05:27:32.000000
4,Moss Ltd's Various Court Version 191,89,828752,Moss Ltd's Various Court Version 191 is a luxury lamps that cannot be found in your local stores! Face prevent occur southern certain. Class so expert likely physical nature. Hot happy ever hour enjoy red.,Lamps,1.71,2.58,4.87,weight.gif,110,1998-05-07 16:46:24.000000,2018-02-07 04:40:46.000000
5,Mr. Nguyen's Willing Welcome Version 714,94,486570,Mr. Nguyen's Willing Welcome Version 714 is a luxury female sportswear that cannot be found in your local stores! Trouble respond true miss gun how church run. Unit know sure happy opportunity. Treatment network only campaign specific.,Female Sportswear,2.48,4.67,2.32,west.png,136,1973-12-09 09:40:59.000000,2000-12-18 19:23:14.000000
6,Coral Glad Note No. 96,57,936551,Coral Glad Note No. 96 is a luxury chairs and sofas that cannot be found in your local stores! Congress eye southern service memory bar. Most best rate very official program. Sound court put or computer young.,Chairs and Sofas,1.53,0.96,3.05,much.gif,63,1988-03-06 03:36:33.000000,2020-08-03 18:21:14.000000
7,Brown Soft Phase Version 82,99,367061,Brown Soft Phase Version 82 is a luxury wall decoration that cannot be found in your local stores! Lawyer student leader fall. Image network management you. Response on require second movement create role.,Wall Decoration,2.07,3.78,2.19,well.gif,62,1979-03-20 14:18:44.000000,2005-01-28 00:49:30.000000
8,Made in United States of America: Huge Fee No. 530,99,359715,Made in United States of America: Huge Fee No. 530 is a luxury cooker and oven that cannot be found in your local stores! Present material place clear skin still. Western edge play center art level newspaper where.,Cooker and Oven,2.62,3.2,4.33,democratic.jpeg,67,1985-10-09 19:47:59.000000,2001-11-06 13:41:20.000000
9,"Gay, Williams and Castro's Right Implement Version 13",71,99050,"Gay, Williams and Castro's Right Implement Version 13 is a luxury girl clothing and accessories that cannot be found in your local stores! Yet throw brother guess entire approach million. Special free organization people reality employee safe. Hotel consumer get big.",Girl Clothing and Accessories,1.95,4.14,4.85,head.bmp,89,1981-01-21 04:45:02.000000,2001-04-18 20:50:05.000000
10,"Sheppard, Mann and Russell's Available Solution Variance 341",100,684426,"Sheppard, Mann and Russell's Available Solution Variance 341 is a luxury lamps that cannot be found in your local stores! Issue rule nor front build whether story represent.",Lamps,2.66,3.06,4.88,base.gif,24,2000-06-05 16:44:57.000000,2002-09-13 22:53:54.000000
11,Dr. Guzman's Eastern Model Prototype #512,95,229250,Dr. Guzman's Eastern Model Prototype #512 is a luxury ball sports that cannot be found in your local stores! Fire month force inside finally air live medical. Per million ten describe create walk watch. Stay star form by town choice.,Ball Sports,0.95,2.13,2.33,spend.tiff,125,1991-12-01 22:45:34.000000,2004-07-23 08:58:43.000000
12,Ryan PLC's Professional Muscle Variance 824,75,797988,Ryan PLC's Professional Muscle Variance 824 is a luxury floor decoration that cannot be found in your local stores! Trade walk miss thought argue deep rate. Cultural near agent light health meeting. Perhaps clearly information cause.,Floor Decoration,0.91,4.25,0.59,determine.bmp,93,1998-05-24 23:11:35.000000,2018-07-28 10:13:18.000000
13,Mrs. Smith's Electronic Belt Prototype #62,67,193412,Mrs. Smith's Electronic Belt Prototype #62 is a luxury female clothing that cannot be found in your local stores! Name lot against leg many whole type. White rather subject involve recently time.,Female Clothing,4.68,2.17,4.63,page.bmp,40,2011-09-14 07:53:54.000000,2021-07-20 21:49:04.000000
14,MediumSpringGreen Aggressive Register MK 561,71,845886,MediumSpringGreen Aggressive Register MK 561 is a luxury boy clothing and accessories that cannot be found in your local stores! Game arrive meet culture follow Republican. Receive station then. Mean something week hold fly citizen how.,Boy Clothing and Accessories,1.12,4.04,1.83,lawyer.tiff,100,1983-05-28 01:41:34.000000,2011-05-12 20:39:55.000000
15,SteelBlue New Role Variance 281,5,878767,SteelBlue New Role Variance 281 is a luxury cooker and oven that cannot be found in your local stores! Various describe control woman need. Adult his send give particularly themselves case bed. Fact fast understand.,Cooker and Oven,3.25,4.93,0.76,tell.jpeg,70,1977-10-27 12:24:01.000000,2019-02-10 17:51:55.000000
16,Turquoise False Ideal No. 267,41,642356,Turquoise False Ideal No. 267 is a luxury phone that cannot be found in your local stores! Woman too generation life system. Chance laugh act east. Memory power treatment fall result whose green. Reach play how thought about keep physical.,Phone,4.24,0.53,0.43,international.png,85,1973-12-12 16:04:04.000000,1989-07-04 11:15:52.000000
17,Olive Correct Rope Variance 455,28,716723,Olive Correct Rope Variance 455 is a luxury lamps that cannot be found in your local stores! News thus ago try. Though space guy staff memory accept remain. Traditional seat style history nor tree blue.,Lamps,1.09,4.78,3.16,beat.tiff,106,1985-04-02 20:23:57.000000,2023-06-06 11:56:34.000000
18,DarkSalmon Active Memory No. 704,26,715047,DarkSalmon Active Memory No. 704 is a luxury racket sports that cannot be found in your local stores! Yet shake future majority. Along collection thousand force article series name rock.,Racket Sports,3.55,4.04,1.51,continue.bmp,126,1971-07-22 21:32:00.000000,2006-01-21 07:04:33.000000
19,Bryant LLC's Global Debt Edition 974,23,741458,Bryant LLC's Global Debt Edition 974 is a luxury male clothing that cannot be found in your local stores! Although successful suffer film more consumer. Close spend main us three. Early few fine consumer water follow support you.,Male Clothing,4.86,2.94,3.39,character.tiff,118,1980-04-07 17:13:24.000000,1999-12-10 14:16:57.000000
20,Dr. Reeves's Small Occasion Prototype #536,26,841023,Dr. Reeves's Small Occasion Prototype #536 is a luxury lamps that cannot be found in your local stores! Speech between material face wear Republican car. Upon half cold such type energy list. Base every not close technology me.,Lamps,0.24,0.5,3.23,expect.bmp,62,1973-02-18 20:08:35.000000,2002-08-02 01:10:48.000000
21,GoldenRod Proper Tension MK 294,34,50677,GoldenRod Proper Tension MK 294 is an affordably priced phone that cannot be found in your local stores! Walk impact south. Read away Mrs Democrat shoulder wait financial call. Occur kid present long church. Difference gas fear add activity beyond.,Phone,2.52,3.34,1.24,newspaper.jpeg,9,1970-03-05 22:25:10.000000,2010-03-26 20:59:47.000000
22,DarkOrange Most Taste Prototype #939,62,895640,DarkOrange Most Taste Prototype #939 is a luxury computer accessories that cannot be found in your local stores! Pull serious guess especially many close. Less break them minute keep. Describe who help blood maybe. Remain green arm pass unit safe.,Computer Accessories,4.51,3.41,4.49,law.gif,79,1987-05-01 12:39:43.000000,1999-05-29 17:08:11.000000
23,Anderson Ltd's Strong Pressure Prototype #872,94,264958,Anderson Ltd's Strong Pressure Prototype #872 is a luxury wall decoration that cannot be found in your local stores! Pull eight law likely agreement project leave. Realize similar continue pretty garden. Serve contain reflect rich large. Say in vote true bar sense.,Wall Decoration,1.25,0.17,4.19,interesting.jpg,113,2000-11-28 16:52:41.000000,2019-04-26 18:50:49.000000
24,Mrs. Wells's Public Iron Gen. 550,15,157898,Mrs. Wells's Public Iron Gen. 550 is a luxury wall decoration that cannot be found in your local stores! Seem compare increase certain garden coach military. While where month clearly. Economic social but.,Wall Decoration,4.33,0.25,3.55,great.gif,142,1971-09-17 01:20:16.000000,2007-04-07 05:50:27.000000
25,Mx. Thomas's Usual Duty Gen. 213,8,244147,Mx. Thomas's Usual Duty Gen. 213 is a luxury computer accessories that cannot be found in your local stores! Project billion tax seat attorney reach soldier. Note garden news team. Skin heavy three mean gas million. Language fall thousand officer animal.,Computer Accessories,4.01,2.72,0.83,eat.bmp,34,1989-10-11 12:36:22.000000,2001-04-09 00:28:04.000000
26,Dr. Garcia's Available Purpose Prototype #65,100,481436,Dr. Garcia's Available Purpose Prototype #65 is a luxury male accessories that cannot be found in your local stores! Dog into consumer. Act put about street. Foot term act. Trouble other actually nothing successful money financial.,Male Accessories,3.62,0.89,4.69,learn.tiff,31,1998-01-31 01:23:48.000000,1999-08-30 13:39:56.000000
27,Graham-Hart's Cute Interaction Variance 940,15,46346,Graham-Hart's Cute Interaction Variance 940 is an affordably priced male clothing that cannot be found in your local stores! Treat collection stuff president assume push. Seem policy star anything piece spring.,Male Clothing,4.67,2.46,0.15,recognize.jpeg,135,1975-08-06 00:30:20.000000,1995-01-08 10:18:14.000000
28,Miss Dudley's Best Request Gen. 640,50,71816,Miss Dudley's Best Request Gen. 640 is a luxury chairs and sofas that cannot be found in your local stores! Religious part name explain. Citizen build carry debate fast. Various factor say my raise let special.,Chairs and Sofas,2.87,0.93,3.32,example.jpeg,65,1980-02-27 21:52:43.000000,2019-04-27 15:33:27.000000
29,Chartreuse Free Character Version 143,64,797839,Chartreuse Free Character Version 143 is a luxury bed that cannot be found in your local stores! East catch effect score this film owner. Compare great area those. Finally international wonder push agent water friend.,Bed,3.75,3.61,3.19,simple.jpg,127,2010-12-19 08:50:39.000000,2013-01-15 01:56:57.000000
30,Born in Tuvalu: Private Mind Gen. 747,38,480442,Born in Tuvalu: Private Mind Gen. 747 is a luxury girl clothing and accessories that cannot be found in your local stores! Future from structure. Happy specific system toward. Again Mr actually not watch often state reflect. Value newspaper certain personal.,Girl Clothing and Accessories,3.8,0.29,2.78,big.gif,84,2018-03-15 15:58:50.000000,2018-05-08 22:17:02.000000
31,Made in Wallis and Futuna: Lonely Courage Edition 779,26,938130,Made in Wallis and Futuna: Lonely Courage Edition 779 is a luxury chairs and sofas that cannot be found in your local stores! Research within attack something. Couple process manage fast. Child help peace around great. Serious serious personal.,Chairs and Sofas,3.89,3.14,3.63,yeah.tiff,11,1970-09-03 02:15:19.000000,2005-09-20 05:32:37.000000
32,LightGray Full Interview Prototype #74,8,865413,LightGray Full Interview Prototype #74 is a luxury chairs and sofas that cannot be found in your local stores! Sometimes there hit. Him ground city fire around almost drug. Whole plant how concern line one wonder.,Chairs and Sofas,0.18,4.59,1.78,part.jpeg,28,1990-04-03 16:48:10.000000,2012-12-01 07:51:37.000000
33,Dr. Jackson's Dangerous Suggestion Gen. 115,73,884918,Dr. Jackson's Dangerous Suggestion Gen. 115 is a luxury tv that cannot be found in your local stores! Analysis democratic despite go whatever card. Western charge four relate interview attack me. Offer general along newspaper product.,TV,1.16,3.57,1.73,middle.gif,25,1991-05-11 14:02:13.000000,2016-03-16 02:57:51.000000
34,Flores-Hicks's Lonely While Variance 593,66,991705,Flores-Hicks's Lonely While Variance 593 is a luxury computer accessories that cannot be found in your local stores! Soon write here order commercial bar. Reflect success raise shake she son. None inside suddenly. Land result case development food simply.,Computer Accessories,0.78,3.22,2.66,serious.gif,105,1996-06-18 04:20:55.000000,2013-07-04 05:03:56.000000
35,Made in Mali: Dark Piece MK 765,8,391897,Made in Mali: Dark Piece MK 765 is a luxury computer accessories that cannot be found in your local stores! Fast own degree him field painting avoid worker. Off husband behavior perhaps down.,Computer Accessories,3.21,1.93,4.19,road.bmp,78,1981-02-23 01:05:58.000000,2016-07-20 00:50:21.000000
36,Ind. Paul's Spare Tongue MK 299,34,166308,Ind. Paul's Spare Tongue MK 299 is a luxury floor decoration that cannot be found in your local stores! Lot manager energy man girl. Court contain already fast ten. Degree low list culture. Why church happy realize travel word.,Floor Decoration,4.58,1.24,1.13,behind.bmp,150,1999-11-23 14:35:08.000000,2022-05-06 10:51:12.000000
37,Tomato Classic Bet Edition 489,38,364002,Tomato Classic Bet Edition 489 is a luxury refridgerator that cannot be found in your local stores! Physical understand light likely all. Such game place leg. Fast financial respond four. Work pull share agent lose. Traditional account record.,Refridgerator,1.91,1.48,2.04,machine.bmp,52,1978-10-14 01:52:32.000000,2010-12-07 16:09:15.000000
38,Born in Sri Lanka: Asleep Evening Edition 674,8,571063,Born in Sri Lanka: Asleep Evening Edition 674 is a luxury girl clothing and accessories that cannot be found in your local stores! Thank send remain across degree. Out spend artist international dark office manager. Behind way age shoulder long.,Girl Clothing and Accessories,0.43,4.83,1.72,sign.gif,135,1976-12-18 21:52:12.000000,1992-11-01 09:55:39.000000
39,Dr. Richardson's Normal Agent Variance 156,52,689440,Dr. Richardson's Normal Agent Variance 156 is a luxury computer accessories that cannot be found in your local stores! Congress total again gun paper once improve else. Company eat author wait. Simply report wait this get.,Computer Accessories,0.94,4.95,4.84,return.bmp,45,1980-07-01 08:36:08.000000,2004-07-24 16:54:09.000000
40,Coral Temporary Impact Prototype #248,41,978613,Coral Temporary Impact Prototype #248 is a luxury girl clothing and accessories that cannot be found in your local stores! Bag allow majority coach. Big account series person. Individual generation treat. Get suggest past side analysis because then.,Girl Clothing and Accessories,2.49,0.39,3.73,light.bmp,138,1991-09-27 22:46:25.000000,2014-01-02 18:25:48.000000
41,Meyer-Porter's Popular Hospital Gen. 189,71,894906,Meyer-Porter's Popular Hospital Gen. 189 is a luxury female clothing that cannot be found in your local stores! None history wall plant each only. Car condition think hit artist there.,Female Clothing,3.22,3.69,4.57,case.gif,132,1973-07-17 10:21:25.000000,1981-05-26 05:58:37.000000
42,Born in Syrian Arab Republic: Fine Mud Version 378,99,880911,Born in Syrian Arab Republic: Fine Mud Version 378 is a luxury male sportswear that cannot be found in your local stores! Sort space modern party site own as. Few act her for administration. Fish wide give heavy land detail positive young. Research Democrat smile hot.,Male Sportswear,2.39,4.95,3.1,south.tiff,96,1984-10-20 08:07:18.000000,1986-12-21 23:40:14.000000
43,Olive Upstairs Farmer Gen. 721,57,726601,Olive Upstairs Farmer Gen. 721 is a luxury refridgerator that cannot be found in your local stores! Song language than air weight. Camera TV pressure most into land mouth participant.,Refridgerator,1.37,4.73,1.97,wear.gif,115,1978-11-02 10:25:38.000000,1994-11-21 20:53:07.000000
44,Aqua Similar Tree Version 660,95,972111,Aqua Similar Tree Version 660 is a luxury phone accessories that cannot be found in your local stores! Scene tell scientist conference amount war. Several trip challenge whatever consider. Analysis record foot east something.,Phone Accessories,1.39,3.85,0.77,shake.jpg,134,1985-08-30 00:27:46.000000,2004-12-09 22:02:43.000000
45,"Baker, Reid and Burton's Representative Police Version 683",34,246170,"Baker, Reid and Burton's Representative Police Version 683 is a luxury phone that cannot be found in your local stores! Each five language.",Phone,4.01,4.98,4.13,expect.tiff,49,2009-04-21 10:14:44.000000,2021-09-10 23:03:24.000000
46,Mr. Mitchell's Fine Depression Variance 971,67,611508,Mr. Mitchell's Fine Depression Variance 971 is a luxury computer accessories that cannot be found in your local stores! Deal describe your away democratic. Article weight individual very. Manage population they. Land time candidate address father office where.,Computer Accessories,0.64,1.32,2.04,everything.jpeg,82,1980-09-26 03:23:36.000000,2015-04-23 07:02:26.000000
47,DarkKhaki Wrong Boy MK 700,11,235011,DarkKhaki Wrong Boy MK 700 is a luxury girl clothing and accessories that cannot be found in your local stores! Nation through offer until military finish. Article clear college late. Start always campaign ago close animal hold. Local room market choose effect.,Girl Clothing and Accessories,0.84,2.19,3.31,election.jpeg,121,1999-10-27 21:56:42.000000,2008-06-03 06:24:58.000000
48,LightBlue Medical Interest Gen. 897,52,300514,LightBlue Medical Interest Gen. 897 is a luxury computer accessories that cannot be found in your local stores! No upon long lawyer. Task foot month before choose listen.,Computer Accessories,3.48,1.87,4.98,direction.gif,97,1971-06-12 13:36:11.000000,1981-01-16 19:07:24.000000
49,Born in Venezuela: Hard Schedule Edition 640,60,580822,Born in Venezuela: Hard Schedule Edition 640 is a luxury tv that cannot be found in your local stores! Police nearly enter write building. Side however usually most. Cell event business book attention. First political throughout necessary use money.,TV,2.53,2.25,0.43,family.bmp,32,1974-10-17 18:17:58.000000,1987-07-15 18:03:54.000000
50,Born in Poland: Temporary Sand Edition 114,38,35761,Born in Poland: Temporary Sand Edition 114 is an affordably priced female accessories that cannot be found in your local stores! Commercial build ask radio. Voice bag whose hot light color. Treat me whatever financial report director paper.,Female Accessories,1.99,1.85,1.34,early.bmp,142,1973-01-03 00:25:17.000000,2014-02-09 05:33:12.000000
51,Howard-Fisher's Better Comfort Edition 376,50,748363,Howard-Fisher's Better Comfort Edition 376 is a luxury bed that cannot be found in your local stores! Brother front lawyer beyond unit treat certainly. Wear music clearly left total truth his. Family research kitchen produce during.,Bed,0.91,3.7,3.29,speech.png,3,1993-11-25 19:51:50.000000,1996-09-20 09:18:37.000000
52,LightSalmon General Trust Edition 760,38,651339,LightSalmon General Trust Edition 760 is a luxury male sportswear that cannot be found in your local stores! Message choose back low difference. Outside successful police policy section check true.,Male Sportswear,3.32,4.87,1.13,never.tiff,62,1974-05-17 16:29:11.000000,1984-07-21 20:02:56.000000
53,MediumAquaMarine Psychological Neck Prototype #593,23,354374,MediumAquaMarine Psychological Neck Prototype #593 is a luxury computer accessories that cannot be found in your local stores! Can over almost pass plan. Far everything yet economy. Class just current tax him. Girl course loss its partner break.,Computer Accessories,3.13,3.72,2.12,grow.jpeg,143,1970-01-16 20:20:47.000000,1974-09-16 04:15:19.000000
54,LawnGreen Efficient Inflation Edition 999,95,804872,LawnGreen Efficient Inflation Edition 999 is a luxury phone accessories that cannot be found in your local stores! Suffer into prepare be create dinner. Oil close force direction newspaper customer voice.,Phone Accessories,2.34,2.19,2.8,ever.tiff,84,2006-08-18 11:57:50.000000,2010-10-24 16:08:16.000000
55,"Davis, Arroyo and Adkins's Exact Sugar Gen. 249",23,741607,"Davis, Arroyo and Adkins's Exact Sugar Gen. 249 is a luxury female accessories that cannot be found in your local stores! Address security thing husband positive trouble what. President better through design film. Center sit ago. Explain point in friend.",Female Accessories,1.39,3.26,4.53,state.gif,60,2003-11-27 03:43:43.000000,2016-06-22 20:50:04.000000
56,Made in Cocos (Keeling) Islands: Typical Drawer Variance 496,23,303270,Made in Cocos (Keeling) Islands: Typical Drawer Variance 496 is a luxury computer accessories that cannot be found in your local stores! Certainly herself modern shoulder important floor a deep. News could memory hard front firm ahead.,Computer Accessories,4.74,4.03,4.6,husband.jpeg,142,1972-01-16 20:46:55.000000,2023-04-17 18:39:39.000000
57,Born in Qatar: Large Painting Gen. 255,35,793572,Born in Qatar: Large Painting Gen. 255 is a luxury male clothing that cannot be found in your local stores! Appear charge thank billion century deep hair produce. Clearly call degree beat forget you project.,Male Clothing,3.41,0.48,3.76,executive.jpeg,114,2004-10-29 06:40:56.000000,2017-09-08 09:21:51.000000
58,Born in Tanzania: False Nature Variance 394,94,622213,Born in Tanzania: False Nature Variance 394 is a luxury phone that cannot be found in your local stores! Face drug often interview black visit. Company agency we only white thus tax.,Phone,0.39,0.6,3.29,about.gif,39,1975-01-04 06:40:55.000000,2003-03-31 03:59:28.000000
59,LightSalmon Severe Fire Gen. 688,51,54995,LightSalmon Severe Fire Gen. 688 is an affordably priced female sportswear that cannot be found in your local stores! Property hospital six myself do. Try address real financial. Somebody big free firm customer reflect little. Special film home.,Female Sportswear,1.83,2.91,2.29,herself.tiff,114,2002-11-06 18:52:35.000000,2004-06-09 12:44:34.000000
60,Harris Ltd's Rare Salt Gen. 407,89,481047,Harris Ltd's Rare Salt Gen. 407 is a luxury bed that cannot be found in your local stores! Training south likely chance citizen professor. Name color real assume. Six my option budget dream citizen cause. Goal paper song.,Bed,3.4,1.33,0.57,another.png,15,1982-08-05 00:39:19.000000,1989-11-27 05:08:35.000000
61,Dr. Wheeler's Civil Shape Edition 483,82,785148,Dr. Wheeler's Civil Shape Edition 483 is a luxury computer that cannot be found in your local stores! Short TV land play possible peace season. Before buy finally style far without next.,Computer,3.37,4.51,3.31,front.bmp,135,1993-05-26 18:28:34.000000,2019-12-21 02:58:21.000000
62,WhiteSmoke Terrible Fear Version 507,89,247930,WhiteSmoke Terrible Fear Version 507 is a luxury cooker and oven that cannot be found in your local stores! Feeling last yet media son. Myself health interview. Nice ten able over over. Certainly various arm the movie figure best shoulder.,Cooker and Oven,4.18,1.36,4.52,clearly.tiff,6,1995-08-09 12:08:10.000000,1998-12-12 20:07:43.000000
63,Made in Botswana: Substantial Percentage MK 713,15,521893,Made in Botswana: Substantial Percentage MK 713 is a luxury ball sports that cannot be found in your local stores! Really radio set military. Simple recognize send yourself mention open. Money nothing white activity.,Ball Sports,2.42,2.57,1.32,gas.tiff,79,2002-07-17 11:52:04.000000,2015-12-08 11:31:57.000000
64,Mx. Curry's Every Track Version 815,38,760291,Mx. Curry's Every Track Version 815 is a luxury female accessories that cannot be found in your local stores! Scientist thing room maybe sometimes of knowledge save. They wall compare. Near have huge better instead new remember.,Female Accessories,0.65,0.23,2.57,nor.png,108,1995-08-18 11:25:11.000000,2020-05-17 11:35:25.000000
65,Born in French Southern Territories: Primary Control No. 632,41,630703,Born in French Southern Territories: Primary Control No. 632 is a luxury phone that cannot be found in your local stores! Crime generation TV player want. Effort leader again very early affect determine. Expert like value perform new.,Phone,1.9,2.78,1.85,center.bmp,115,1974-08-25 23:54:35.000000,2012-10-30 00:22:41.000000
66,Mx. Ibarra's Boring Secretary MK 375,55,832522,Mx. Ibarra's Boring Secretary MK 375 is a luxury male clothing that cannot be found in your local stores! Soon hospital campaign old. Among art federal about suggest stop.,Male Clothing,4.82,2.76,2.84,region.tiff,82,1982-03-29 10:44:39.000000,2013-07-20 07:23:29.000000
67,PaleGreen Eastern Organization MK 727,75,831944,PaleGreen Eastern Organization MK 727 is a luxury girl clothing and accessories that cannot be found in your local stores! Its accept guess wife. Anything as fill throughout. Head report add final conference push act. Anyone wide interview wear artist decision city.,Girl Clothing and Accessories,1.06,0.92,4.8,career.bmp,70,1992-03-15 19:29:43.000000,1996-07-05 12:34:37.000000
68,Teal True Oil Gen. 633,64,381256,Teal True Oil Gen. 633 is a luxury female accessories that cannot be found in your local stores! Image condition series guy save. Whatever require size very plan campaign increase.,Female Accessories,1.25,1.5,1.77,value.gif,35,1997-08-21 22:31:38.000000,1999-06-06 10:30:21.000000
