id,title,seller_id,price,description,category,length,width,height,image,remaining,created_at,updated_at
69,Born in Turkey: Suspicious Blue Prototype #461,51,107983,Born in Turkey: Suspicious Blue Prototype #461 is a luxury chairs and sofas that cannot be found in your local stores! Record modern exactly doctor if during bill. Seven evening party last clear. Movie expect already follow subject store should.,Chairs and Sofas,4.77,1.82,1.34,require.jpeg,23,1975-02-19 19:29:54.000000,1993-04-13 05:23:25.000000
70,Made in Sao Tome and Principe: Cheap Question Version 966,35,564989,Made in Sao Tome and Principe: Cheap Question Version 966 is a luxury male sportswear that cannot be found in your local stores! Tv if right here. Month senior information whatever large take hospital far. Strong assume provide well gas across and.,Male Sportswear,1.72,0.92,2.28,we.jpeg,92,1991-05-23 06:18:24.000000,1997-02-09 18:29:42.000000
71,Born in Serbia: Relevant Development Edition 985,82,814636,Born in Serbia: Relevant Development Edition 985 is a luxury phone accessories that cannot be found in your local stores! Particular somebody cut today that. Visit listen deep. Impact pay church back cut far. Third him business policy. Though language rather career.,Phone Accessories,1.97,0.82,4.36,dark.png,48,1972-09-12 18:15:56.000000,2023-04-06 19:38:13.000000
72,Mr. Harris's Dependent Tone Version 771,11,978701,Mr. Harris's Dependent Tone Version 771 is a luxury female accessories that cannot be found in your local stores! Appear my tree difference catch. Condition exactly second particularly word among.,Female Accessories,2.27,2.99,3.68,her.bmp,123,1999-07-31 07:43:12.000000,2019-03-21 03:48:03.000000
73,DarkOliveGreen Free Farmer Version 227,55,298210,DarkOliveGreen Free Farmer Version 227 is a luxury girl clothing and accessories that cannot be found in your local stores! Expect finally onto. With concern none agree lay local. Participant area position listen minute center.,Girl Clothing and Accessories,2.51,2.69,1.52,peace.jpeg,58,1983-04-05 15:14:10.000000,2016-05-02 04:30:10.000000
74,Garcia LLC's Nice Investment Version 259,5,799504,Garcia LLC's Nice Investment Version 259 is a luxury racket sports that cannot be found in your local stores! Employee finish structure region put. Money charge might maintain director. Garden a green threat.,Racket Sports,4.93,3.66,0.88,ground.jpg,117,1981-06-21 15:23:50.000000,1993-05-29 03:27:22.000000
75,Beige Obvious Stranger Variance 853,75,168181,Beige Obvious Stranger Variance 853 is a luxury racket sports that cannot be found in your local stores! Buy former common there. Most meeting him concern. Industry soldier choice campaign field.,Racket Sports,1.75,2.02,1.13,hot.tiff,124,2005-02-20 23:06:03.000000,2022-05-27 22:02:06.000000
76,Born in Aruba: Impossible Bend MK 845,41,52812,Born in Aruba: Impossible Bend MK 845 is an affordably priced chairs and sofas that cannot be found in your local stores! Surface career billion civil young. Miss design our draw with real employee.,Chairs and Sofas,4.25,3.26,0.89,no.jpg,135,1975-01-26 18:30:40.000000,1984-04-17 12:30:04.000000
77,Hodges LLC's Any Pause Prototype #809,34,211371,Hodges LLC's Any Pause Prototype #809 is a luxury male clothing that cannot be found in your local stores! Clear meet record nearly maybe. Score road close understand. Against issue field be vote thousand to financial. Upon since sense.,Male Clothing,3.41,3.84,2.09,law.png,62,1985-10-03 10:09:08.000000,1997-08-04 14:17:26.000000
78,Made in United Arab Emirates: Embarrassed Classroom Edition 905,52,663643,Made in United Arab Emirates: Embarrassed Classroom Edition 905 is a luxury female sportswear that cannot be found in your local stores! Add method six party black student indeed notice. Test take TV compare inside cell. School weight happy. Leader increase popular toward.,Female Sportswear,2.21,4.7,2.41,majority.jpeg,143,2013-03-21 21:49:13.000000,2022-12-26 19:28:56.000000
79,OliveDrab Both God Variance 547,5,956852,OliveDrab Both God Variance 547 is a luxury male accessories that cannot be found in your local stores! Pm community nothing fight now likely bed. Only although get under. Whom her family try loss card. Husband book major include somebody.,Male Accessories,0.45,4.96,3.97,hand.bmp,131,1988-10-17 15:06:11.000000,1989-08-25 04:22:12.000000
80,Born in Samoa: All Pause Edition 212,41,551272,Born in Samoa: All Pause Edition 212 is a luxury computer accessories that cannot be found in your local stores! Low adult process these her. Environmental summer political despite wind.,Computer Accessories,1.71,2.88,4.28,hotel.gif,71,1998-02-26 09:01:10.000000,2017-03-17 13:02:28.000000
81,DarkCyan Junior Subject No. 31,50,395646,DarkCyan Junior Subject No. 31 is a luxury refridgerator that cannot be found in your local stores! Today ok thing word low hospital. Party hospital raise statement sit.,Refridgerator,3.01,1.24,4.11,decide.bmp,101,1999-08-27 11:03:08.000000,2023-07-03 14:29:53.000000
82,Mr. Jones's Late Daughter Edition 757,99,541279,Mr. Jones's Late Daughter Edition 757 is a luxury female clothing that cannot be found in your local stores! Draw defense how want. Account determine process should scientist Congress. Daughter adult politics TV.,Female Clothing,2.28,4.17,3.05,same.bmp,120,2011-08-25 07:29:10.000000,2017-03-26 00:09:19.000000
83,Made in British Virgin Islands: Downtown Pin MK 151,33,682543,Made in British Virgin Islands: Downtown Pin MK 151 is a luxury floor decoration that cannot be found in your local stores! Wide include long speak poor. Collection write nearly group. Energy young language hope involve of western arm.,Floor Decoration,3.06,3.62,2.66,computer.jpg,118,1977-10-21 17:09:55.000000,2016-05-22 16:30:40.000000
84,Made in Kyrgyz Republic: Some Promise Gen. 862,11,927965,Made in Kyrgyz Republic: Some Promise Gen. 862 is a luxury male accessories that cannot be found in your local stores! Step room approach political. Factor red be old church.,Male Accessories,2.7,4.29,3.68,whom.tiff,72,1981-06-07 14:51:24.000000,1984-10-09 05:56:29.000000
85,Mrs. Russell's National Throat No. 230,71,954379,Mrs. Russell's National Throat No. 230 is a luxury girl clothing and accessories that cannot be found in your local stores! Machine heart indeed. According month music international economic.,Girl Clothing and Accessories,0.47,3.74,3.67,fear.bmp,75,1980-02-17 10:42:35.000000,1999-03-31 01:10:30.000000
86,Born in Paraguay: Direct Housing Edition 903,26,562215,Born in Paraguay: Direct Housing Edition 903 is a luxury female sportswear that cannot be found in your local stores! South itself when. Sport there approach wife happy. Want especially wear good spring from.,Female Sportswear,0.2,0.22,1.34,boy.bmp,94,1988-07-20 18:45:39.000000,2003-11-07 12:01:49.000000
87,Kelly Inc's Rough Description Gen. 10,11,329171,Kelly Inc's Rough Description Gen. 10 is a luxury phone that cannot be found in your local stores! Road nice use various everything seat. Southern return ready rate. Follow commercial left.,Phone,4.47,4.47,3.3,also.tiff,38,1976-12-07 03:37:52.000000,1984-07-19 03:34:32.000000
88,Mx. Goodwin's Own Lawyer No. 118,67,505833,Mx. Goodwin's Own Lawyer No. 118 is a luxury wall decoration that cannot be found in your local stores! Situation action opportunity while likely. Catch rate bad job think measure space power. Our star name few ask tough.,Wall Decoration,2.63,1.48,2.26,growth.tiff,92,1983-07-25 11:03:23.000000,1996-01-03 16:57:56.000000
89,DarkGoldenRod Weekly Sector Prototype #835,84,642160,DarkGoldenRod Weekly Sector Prototype #835 is a luxury chairs and sofas that cannot be found in your local stores! Our history light movie leg. Room center popular. Work thought family place cut send available. Old quickly dinner Mr song.,Chairs and Sofas,2.87,2.08,2.53,few.png,21,1974-10-09 10:01:02.000000,1975-09-23 11:17:20.000000
90,DimGray Weird Organization No. 718,64,945809,DimGray Weird Organization No. 718 is a luxury cooker and oven that cannot be found in your local stores! A leader others whether. True hard sit. East something Congress feeling family article.,Cooker and Oven,3.32,1.75,4.68,character.jpg,26,1985-08-19 10:57:57.000000,2005-09-23 10:51:35.000000
91,Ind. Taylor's Personal Basis No. 126,60,144825,Ind. Taylor's Personal Basis No. 126 is a luxury tv that cannot be found in your local stores! Create enough couple local middle class. Sing we social role. Thousand strategy itself alone expert happy.,TV,2.14,0.71,3.16,forget.bmp,89,2001-12-21 06:16:22.000000,2005-05-02 12:03:52.000000
92,Mx. Mercer's Weird Ad MK 798,62,476691,Mx. Mercer's Weird Ad MK 798 is a luxury female accessories that cannot be found in your local stores! Assume concern far whose high listen. Describe leave he. Growth there term citizen. Above fact who fire draw less. President line bank when.,Female Accessories,3.99,4.26,1.63,society.png,77,1980-04-22 05:49:51.000000,1998-08-08 23:43:05.000000
93,Ford-Hicks's Realistic Housing MK 407,62,240596,Ford-Hicks's Realistic Housing MK 407 is a luxury computer accessories that cannot be found in your local stores! Project soon hard your executive. Education book beat face something enough agency.,Computer Accessories,2.71,2.87,1.57,remember.tiff,120,1982-09-08 12:58:51.000000,1982-10-02 17:08:04.000000
94,Thistle Tall Structure Prototype #59,74,512328,Thistle Tall Structure Prototype #59 is a luxury phone accessories that cannot be found in your local stores! Process line often personal. Wide stay someone attorney show structure. Sure police population plant security beautiful.,Phone Accessories,3.49,2.97,0.77,close.gif,91,2021-02-23 01:29:49.000000,2023-07-16 12:43:00.000000
95,Mx. Boyer's Smooth Effect No. 254,23,225658,Mx. Boyer's Smooth Effect No. 254 is a luxury tv that cannot be found in your local stores! Treat space former action produce program. Listen fast inside. Door push respond receive strong. College hard main site trade important series.,TV,3.85,4.12,0.38,fill.png,56,1985-08-18 22:49:12.000000,2004-03-25 10:29:03.000000
96,"Brown, Delacruz and Lee's Unusual Error Prototype #332",64,696523,"Brown, Delacruz and Lee's Unusual Error Prototype #332 is a luxury racket sports that cannot be found in your local stores! Government coach peace lose need. Cause might pay. Teach huge firm former stock different treat any.",Racket Sports,1.41,0.27,0.92,pay.gif,29,1973-08-04 10:44:03.000000,2001-03-06 13:30:13.000000
97,Born in Chile: Classic Luck Gen. 244,34,173359,Born in Chile: Classic Luck Gen. 244 is a luxury female sportswear that cannot be found in your local stores! Mother none remain from score red. Kid indicate shoulder especially PM.,Female Sportswear,2.33,3.98,3.15,remain.png,24,1992-12-10 00:41:20.000000,1994-11-05 05:36:22.000000
98,"Walter, Mckinney and Jackson's Most Stroke Variance 734",52,531180,"Walter, Mckinney and Jackson's Most Stroke Variance 734 is a luxury male sportswear that cannot be found in your local stores! Attorney have six bit. Ever shoulder head we theory. See less stay audience threat. Player by family.",Male Sportswear,0.65,2.5,4.0,standard.gif,61,1973-04-08 11:50:39.000000,2009-10-15 05:06:06.000000
99,RoyalBlue Smart Code Variance 576,55,490022,RoyalBlue Smart Code Variance 576 is a luxury tv that cannot be found in your local stores! Control other who style three any education sound.,TV,3.19,4.38,2.28,study.png,126,1980-10-21 22:40:06.000000,1989-09-07 11:08:40.000000
100,Castillo Inc's Western Degree Prototype #598,5,437809,Castillo Inc's Western Degree Prototype #598 is a luxury cooker and oven that cannot be found in your local stores! Something wait discuss suddenly. Assume someone religious win most likely.,Cooker and Oven,0.55,3.58,3.04,explain.jpg,47,1993-11-19 06:49:41.000000,2011-08-09 20:41:08.000000
101,Made in Libyan Arab Jamahiriya: Existing Model MK 177,34,979773,Made in Libyan Arab Jamahiriya: Existing Model MK 177 is a luxury computer that cannot be found in your local stores! Back green discussion order relate wife. Father Mrs job summer yet out. Senior detail wonder Mr true morning.,Computer,4.98,4.05,2.28,myself.jpeg,61,1973-06-11 04:39:11.000000,1995-07-31 04:01:03.000000
102,Made in Cuba: Guilty South Prototype #482,38,487362,Made in Cuba: Guilty South Prototype #482 is a luxury bed that cannot be found in your local stores! Far black dark national fast. Collection fall recently. When per quickly why enjoy.,Bed,0.44,2.14,2.13,whole.gif,21,1990-06-29 14:27:49.000000,2006-03-22 12:01:09.000000
103,DarkKhaki Hard Spirit Variance 534,38,410150,DarkKhaki Hard Spirit Variance 534 is a luxury racket sports that cannot be found in your local stores! Chance fear age worker. Feeling year many matter song. Become care always girl seat anything. Paper maintain record.,Racket Sports,0.84,4.74,0.88,too.jpg,4,2011-08-24 21:39:25.000000,2021-02-19 13:57:19.000000
104,Blair LLC's Entire Game Prototype #80,55,278565,Blair LLC's Entire Game Prototype #80 is a luxury phone that cannot be found in your local stores! Race create together find box too them. Wall million four production. Industry early gun like.,Phone,1.93,2.96,3.58,police.png,34,2000-07-05 22:35:16.000000,2015-11-29 17:59:33.000000
105,Mrs. Douglas's Empty Steak Gen. 792,74,817095,Mrs. Douglas's Empty Steak Gen. 792 is a luxury phone accessories that cannot be found in your local stores! Reality bring down record professional. Stay mother tree half letter. Foreign five consider. Entire direction relate later practice.,Phone Accessories,4.37,3.13,3.32,every.jpeg,93,1974-11-29 00:59:41.000000,1979-05-30 23:59:59.000000
106,Mr. Young's Complex Counter MK 762,84,478691,Mr. Young's Complex Counter MK 762 is a luxury floor decoration that cannot be found in your local stores! Foot section building mission major. Join light with theory. Shoulder responsibility land who right pattern.,Floor Decoration,1.15,0.35,1.56,support.png,107,1994-02-24 06:33:12.000000,2016-06-10 23:16:52.000000
107,Made in Liechtenstein: Drunk Agency Variance 425,74,974621,Made in Liechtenstein: Drunk Agency Variance 425 is a luxury ball sports that cannot be found in your local stores! Family anything stage beyond land. Also hour interesting look protect TV. Marriage paper past ten onto base. Artist street season doctor recognize.,Ball Sports,1.92,0.54,4.83,stage.bmp,70,2016-11-22 05:21:35.000000,2019-08-29 01:41:59.000000
108,Mx. Johnson's Downtown Reputation Variance 328,35,244687,Mx. Johnson's Downtown Reputation Variance 328 is a luxury phone that cannot be found in your local stores! Whom hot film now sell start. Lose but blue campaign. Our without main spend beautiful people. Minute myself pattern us you down suffer.,Phone,2.13,3.93,1.3,law.jpeg,109,1970-02-15 00:24:54.000000,1991-06-30 18:33:18.000000
109,Mrs. Jenkins's Common Bathroom Version 362,66,95194,Mrs. Jenkins's Common Bathroom Version 362 is a luxury wall decoration that cannot be found in your local stores! Television kitchen charge race employee east eight.,Wall Decoration,3.06,4.59,2.21,more.jpg,95,1979-03-14 13:34:26.000000,1999-12-01 13:29:07.000000
110,LightSeaGreen Free User No. 839,75,214304,LightSeaGreen Free User No. 839 is a luxury refridgerator that cannot be found in your local stores! Artist boy his doctor mission small collection. Size team out sure.,Refridgerator,0.18,2.03,4.1,society.tiff,143,1996-12-13 17:12:23.000000,2004-01-30 09:52:01.000000
111,Born in Sierra Leone: Mobile President MK 686,57,171143,Born in Sierra Leone: Mobile President MK 686 is a luxury female sportswear that cannot be found in your local stores! Company put compare stay event. National yeah color may available. Point all practice hospital may nor sister occur.,Female Sportswear,2.26,0.12,4.05,anything.png,75,2016-08-11 14:39:56.000000,2022-08-05 06:08:56.000000
112,"Ellison, Jackson and Stephens's Dear Society Version 80",52,859737,"Ellison, Jackson and Stephens's Dear Society Version 80 is a luxury refridgerator that cannot be found in your local stores! Politics author close whole evidence. Usually back coach share behind speak citizen. Thousand politics force detail movie.",Refridgerator,1.83,2.46,2.4,southern.bmp,100,2009-08-04 15:27:38.000000,2013-03-05 23:50:58.000000
113,Teal Neat Sector Gen. 640,62,678684,Teal Neat Sector Gen. 640 is a luxury female clothing that cannot be found in your local stores! Piece yourself recognize learn management statement. Campaign reveal case government trip couple. Only task in degree.,Female Clothing,4.02,3.3,2.06,simple.gif,145,1994-09-26 16:56:59.000000,2003-11-29 07:42:44.000000
114,DeepSkyBlue Dark Recognition Prototype #854,82,371897,DeepSkyBlue Dark Recognition Prototype #854 is a luxury male clothing that cannot be found in your local stores! Whatever recent television real. Free food about together note several just against. Fill individual serious turn position.,Male Clothing,4.82,1.63,4.77,avoid.bmp,11,1984-04-06 01:54:44.000000,2023-01-07 15:32:02.000000
115,DarkGoldenRod Brilliant Family MK 445,35,75662,DarkGoldenRod Brilliant Family MK 445 is a luxury phone accessories that cannot be found in your local stores! Focus provide something chair community term back. Site poor join present despite song. How full walk necessary environment.,Phone Accessories,0.62,1.67,3.01,anyone.jpg,91,1997-09-28 15:49:17.000000,2020-10-13 05:17:14.000000
116,Born in Cyprus: Certain Plate Edition 910,8,484303,Born in Cyprus: Certain Plate Edition 910 is a luxury ball sports that cannot be found in your local stores! Into fill couple evidence note budget. Box turn throw other floor industry of. Project so around indeed career size or.,Ball Sports,3.3,4.49,1.44,main.jpeg,13,1987-04-01 05:38:29.000000,2015-11-01 15:19:14.000000
117,Born in Iran: Great Recipe No. 400,73,667263,Born in Iran: Great Recipe No. 400 is a luxury phone that cannot be found in your local stores! Single necessary close even woman doctor likely from. Brother almost none administration they. Wide red raise dinner.,Phone,3.41,3.88,4.35,remember.jpeg,146,2006-11-05 01:46:36.000000,2016-08-06 16:44:13.000000
118,Ms. Wallace's Single Peak MK 527,100,237042,Ms. Wallace's Single Peak MK 527 is a luxury chairs and sofas that cannot be found in your local stores! Ability determine would new experience stop. Stuff support up. Today civil crime really although space spend.,Chairs and Sofas,2.92,4.28,1.99,good.jpg,42,1998-10-14 10:54:19.000000,2002-05-27 06:42:16.000000
119,Misc. Santiago's Consistent Tour Gen. 692,16,257476,Misc. Santiago's Consistent Tour Gen. 692 is a luxury lamps that cannot be found in your local stores! She fact factor tree example computer local. Stay need my live response never dog money. Quality protect large nature civil early instead.,Lamps,1.85,2.38,4.47,why.tiff,128,1984-09-25 05:17:08.000000,2007-11-25 04:58:24.000000
120,Made in Tonga: Foreign Sand MK 897,99,359173,Made in Tonga: Foreign Sand MK 897 is a luxury bed that cannot be found in your local stores! Current street instead factor home center. Will half music those possible still research.,Bed,3.58,2.21,1.95,serve.bmp,88,1986-08-22 17:31:30.000000,2022-10-22 14:44:03.000000
121,"Torres, Parker and Torres's Nearby King MK 115",41,330911,"Torres, Parker and Torres's Nearby King MK 115 is a luxury floor decoration that cannot be found in your local stores! Remember we gas former animal happy stand. His every open opportunity little war role. Owner party away impact start hundred different.",Floor Decoration,1.83,2.52,0.94,American.jpeg,17,1976-05-12 05:43:00.000000,1981-06-26 10:09:06.000000
122,Mrs. Larson's Unhappy Author Prototype #620,38,957255,Mrs. Larson's Unhappy Author Prototype #620 is a luxury computer accessories that cannot be found in your local stores! Reach season friend forward reveal better. Him town of. Mission will war early near.,Computer Accessories,1.93,0.12,3.42,night.gif,6,1999-12-04 23:41:33.000000,2004-12-05 14:29:25.000000
123,DarkViolet Slight Outside No. 696,89,634928,DarkViolet Slight Outside No. 696 is a luxury male sportswear that cannot be found in your local stores! Respond gun take control detail. Interest threat never garden as appear nature development.,Male Sportswear,1.61,3.44,3.83,affect.tiff,15,2006-01-08 05:25:18.000000,2006-06-27 07:49:08.000000
124,MediumOrchid Unique Cousin MK 492,55,709006,MediumOrchid Unique Cousin MK 492 is a luxury computer that cannot be found in your local stores! Wall face total my enter north. Along commercial interest. Audience anyone war recent design. Exactly garden why last foreign charge.,Computer,2.28,2.51,1.71,guy.tiff,59,1982-02-16 17:02:37.000000,2021-02-06 20:45:33.000000
125,Smith-Smith's Unlikely Picture No. 698,71,592880,Smith-Smith's Unlikely Picture No. 698 is a luxury phone that cannot be found in your local stores! We painting reason number in position and. Window quality soon recently discover. Suddenly explain best happy fly.,Phone,3.2,3.98,1.96,news.bmp,68,2008-01-10 21:39:20.000000,2019-12-17 03:41:35.000000
126,Made in Niue: Crazy Size No. 602,38,170837,Made in Niue: Crazy Size No. 602 is a luxury phone that cannot be found in your local stores! Report task eight continue behavior. Sit letter friend. Significant than owner there also worry. Project time senior mouth move program.,Phone,3.52,3.77,1.51,involve.tiff,72,1996-05-27 12:52:46.000000,2012-07-15 12:03:41.000000
127,Made in Saint Martin: Curious Election Variance 937,73,174437,Made in Saint Martin: Curious Election Variance 937 is a luxury wall decoration that cannot be found in your local stores! Design hair eat type. Decision girl see yard. Ball because world usually public world.,Wall Decoration,3.09,3.44,2.25,summer.bmp,24,1986-02-20 06:23:18.000000,2013-06-25 07:51:55.000000
128,Born in Cuba: Less Sample Gen. 971,57,139970,Born in Cuba: Less Sample Gen. 971 is a luxury male clothing that cannot be found in your local stores! Avoid listen kitchen subject sign sense phone painting. Stay account difficult camera also public. Picture hand arm test. Agency such something seem.,Male Clothing,4.72,1.4,4.34,official.jpeg,103,1984-10-02 19:23:55.000000,1991-07-24 03:12:11.000000
129,Born in Antigua and Barbuda: Distinct Tool MK 144,64,65269,Born in Antigua and Barbuda: Distinct Tool MK 144 is an affordably priced refridgerator that cannot be found in your local stores! College key success sell challenge stay. Prevent conference deep dinner between company.,Refridgerator,0.75,4.19,3.86,laugh.jpeg,70,1977-09-25 10:25:58.000000,2009-03-08 11:35:02.000000
130,SpringGreen Own Efficiency MK 484,34,760943,SpringGreen Own Efficiency MK 484 is a luxury computer accessories that cannot be found in your local stores! Modern morning require art. Foot give always win fact along authority. By machine note bad data. Step commercial leg gas finish fine.,Computer Accessories,4.86,3.71,4.55,different.jpg,128,2001-12-12 17:27:42.000000,2010-12-16 20:44:20.000000
131,Dr. Rivers's White Mistake MK 754,57,459543,Dr. Rivers's White Mistake MK 754 is a luxury racket sports that cannot be found in your local stores! Guy leg feel. Even their subject hold three. Agent leave spend move response wall society.,Racket Sports,2.58,3.41,3.14,even.jpg,8,1975-01-23 14:01:38.000000,2022-07-12 09:34:49.000000
132,Harris PLC's Dear Guy MK 769,82,513664,Harris PLC's Dear Guy MK 769 is a luxury ball sports that cannot be found in your local stores! Less send better nothing fact. Pressure tough try reflect call into. Prepare look notice station single small enough.,Ball Sports,2.61,2.55,3.51,never.jpeg,135,2001-08-05 20:00:26.000000,2009-09-27 21:26:57.000000
133,Ramos-Miller's Sensitive Golf Version 537,60,228897,Ramos-Miller's Sensitive Golf Version 537 is a luxury racket sports that cannot be found in your local stores! Tell address beautiful news animal Mr open. Hundred wind impact news research forget. More think say manage development strong trial.,Racket Sports,1.25,2.25,2.42,practice.png,74,1994-10-04 16:34:18.000000,2016-03-17 01:38:36.000000
134,Clark and Sons's Creative Ability Version 844,99,643168,Clark and Sons's Creative Ability Version 844 is a luxury bed that cannot be found in your local stores! These usually serve. Right part yes in discover drug whole world. Trial realize feel way task ok. Several discussion push customer live despite set.,Bed,3.54,2.43,0.43,single.png,25,1983-07-05 02:55:54.000000,2015-01-10 21:22:43.000000
135,Brock Ltd's Helpful Coast MK 654,5,187163,Brock Ltd's Helpful Coast MK 654 is a luxury male accessories that cannot be found in your local stores! Reflect culture quality. Close reason international cut indeed order.,Male Accessories,4.54,4.21,1.74,seven.jpg,89,1974-11-14 03:45:26.000000,2005-07-08 02:58:15.000000
136,Made in Mauritania: Each Stock No. 608,57,914383,Made in Mauritania: Each Stock No. 608 is a luxury bed that cannot be found in your local stores! Rise current room within entire on summer. Cell sing decision commercial very image song. People contain bed big.,Bed,0.61,1.42,0.62,wish.gif,38,1970-04-04 12:17:53.000000,2012-07-24 05:47:28.000000
137,Mx. Fisher's Weird Dog Gen. 451,75,161889,Mx. Fisher's Weird Dog Gen. 451 is a luxury boy clothing and accessories that cannot be found in your local stores! Wish again prove. State public various worker garden. Claim week away behavior sit. Never garden put. City themselves help.,Boy Clothing and Accessories,4.94,1.92,0.71,computer.jpeg,109,1983-08-07 08:52:50.000000,2002-12-25 20:00:21.000000
138,Made in Equatorial Guinea: Tall Hope Gen. 675,100,145639,Made in Equatorial Guinea: Tall Hope Gen. 675 is a luxury tv that cannot be found in your local stores! Water trial doctor attention important. Year these people owner agree. Kitchen avoid animal mission sport.,TV,4.84,4.7,0.31,theory.gif,141,1973-11-05 01:52:07.000000,2000-08-11 19:18:26.000000
